{
  "$schema": "https://json-schema.org/draft/2020-12/schema",
  "title": "bold700 HQ registry",
  "type": "object",
  "required": ["owner", "clusters", "projects", "agents"],
  "properties": {
    "owner": { "type": "string" },
    "world_url": { "type": "string" },
    "clusters": {
      "type": "object",
      "additionalProperties": {
        "type": "object", "required": ["label", "color"],
        "properties": { "label": { "type": "string" }, "color": { "type": "string", "pattern": "^#[0-9a-fA-F]{6}$" }, "agents": { "type": "array", "items": { "type": "string" } } }
      }
    },
    "projects": {
      "type": "object",
      "additionalProperties": {
        "type": "object", "required": ["cluster"],
        "properties": {
          "cluster": { "type": "string" },
          "description": { "type": "string" },
          "status": { "enum": ["active", "paused", "archived", "idea"] },
          "agents": { "type": "array", "items": { "type": "string" } },
          "links": { "type": "object", "additionalProperties": { "type": "string" } }
        }
      }
    },
    "agents": {
      "type": "object",
      "additionalProperties": { "type": "object", "required": ["description", "file"], "properties": { "description": { "type": "string" }, "file": { "type": "string" } } }
    }
  }
}
