{
  "$schema": "./docs/registry.schema.json",
  "owner": "bold700",
  "world_url": "https://bold700.github.io/hq/",
  "clusters": {
    "fitness":  { "label": "Fitness",        "color": "#ff6b4a", "agents": ["fitness-domain", "code-reviewer"] },
    "penpot":   { "label": "Penpot & tokens", "color": "#7c5cff", "agents": ["penpot-expert", "design-system-guardian", "code-reviewer"] },
    "bold700":  { "label": "bold700 bedrijf", "color": "#ffc94a", "agents": ["ux-reviewer", "design-system-guardian", "code-reviewer"] },
    "klanten":  { "label": "Klanten",        "color": "#3ddc97", "agents": ["ux-reviewer", "code-reviewer"] },
    "tools":    { "label": "Tools & admin",  "color": "#4ab8ff", "agents": ["code-reviewer"] },
    "lab":      { "label": "Lab",            "color": "#9aa3b2", "agents": ["code-reviewer"] }
  },
  "projects": {
    "hq":                     { "cluster": "bold700", "description": "Deze hub: agents, skills, registry en 3D-wereld", "status": "active" },
    "LiftLog":                { "cluster": "fitness", "description": "Trainingslogboek voor PT en sporter (web, iOS, Android)", "status": "active", "agents": ["ux-reviewer"] },
    "FitnessFlow":            { "cluster": "fitness", "description": "Trainingsflow-app", "status": "paused" },
    "workout-timer":          { "cluster": "fitness", "description": "Interval- en rusttimer", "status": "paused" },
    "exercise-database":      { "cluster": "fitness", "description": "Oefeningendatabase met spiergroepen", "status": "paused" },
    "foodscan":               { "cluster": "fitness", "description": "Voeding scannen en loggen", "status": "paused" },
    "Gr8ful":                 { "cluster": "fitness", "description": "Dankbaarheidsdagboek", "status": "paused" },

    "penpotmcp":              { "cluster": "penpot", "description": "Penpot MCP-server voor Claude", "status": "active" },
    "penpot-slots":           { "cluster": "penpot", "description": "Slots-plugin voor Penpot componenten", "status": "active" },
    "penpot-broken-component-repair": { "cluster": "penpot", "description": "Repareert losgekoppelde componenten", "status": "active" },
    "penpot-tokens-merge":    { "cluster": "penpot", "description": "Design tokens samenvoegen", "status": "active" },
    "penpot-material-theme-builder": { "cluster": "penpot", "description": "Material 3 thema's bouwen in Penpot", "status": "paused" },
    "penpot-to-html":         { "cluster": "penpot", "description": "Penpot-ontwerp naar HTML", "status": "paused" },
    "penpot-design-assistant":{ "cluster": "penpot", "description": "AI-assistent in Penpot", "status": "paused" },
    "Pen2AE":                 { "cluster": "penpot", "description": "Penpot naar After Effects", "status": "paused" },
    "material-symbols-font-plugin": { "cluster": "penpot", "description": "Material Symbols in Penpot", "status": "paused" },
    "Token-Checker":          { "cluster": "penpot", "description": "Controleert design tokens", "status": "paused" },
    "designpartner":          { "cluster": "penpot", "description": "Design-partner tooling", "status": "active" },

    "bold700-site":           { "cluster": "bold700", "description": "Website van bold700", "status": "active", "agents": ["ux-reviewer"] },
    "bold700-ux-review-app":  { "cluster": "bold700", "description": "UX-review app", "status": "active" },
    "bold700-ux-reviews":     { "cluster": "bold700", "description": "Gepubliceerde UX-reviews", "status": "active" },
    "bold700-design-system":  { "cluster": "bold700", "description": "Het bold700 design system", "status": "active" },
    "amp-design-system":      { "cluster": "bold700", "description": "AMP design system", "status": "paused" },
    "jonathan-style-guide":   { "cluster": "bold700", "description": "Style guide", "status": "paused" },
    "website-leads":          { "cluster": "bold700", "description": "Leads vanaf de website", "status": "paused" },
    "daily":                  { "cluster": "bold700", "description": "Dagelijkse notities en routines", "status": "active" },
    "cv":                     { "cluster": "bold700", "description": "CV-site", "status": "paused" },
    "privacy":                { "cluster": "bold700", "description": "Privacyverklaringen voor de apps", "status": "paused" },
    "icns":                   { "cluster": "bold700", "description": "Iconenset", "status": "paused" },
    "iKons":                  { "cluster": "bold700", "description": "Iconenset", "status": "paused" },
    "Fonticon":               { "cluster": "bold700", "description": "Icon-font tooling", "status": "paused" },

    "vastgoedagent":          { "cluster": "klanten", "description": "Vastgoed-agent", "status": "active" },
    "margot-schuijff":        { "cluster": "klanten", "description": "Klantsite", "status": "paused" },
    "ambachtelijke-bakker":   { "cluster": "klanten", "description": "Klantsite", "status": "paused" },
    "de-lachende-tuinman":    { "cluster": "klanten", "description": "Klantsite (gearchiveerd)", "status": "archived" },
    "aalo-opleiding":         { "cluster": "klanten", "description": "Opleidingssite", "status": "paused" },
    "motorklant":             { "cluster": "klanten", "description": "Klantbeheer motorzaak", "status": "paused" },
    "motodash":               { "cluster": "klanten", "description": "Dashboard motorzaak", "status": "paused" },
    "sauwell":                { "cluster": "klanten", "description": "Klantsite", "status": "paused" },
    "biggiewebsite":          { "cluster": "klanten", "description": "Website Biggie", "status": "paused" },
    "Biggie":                 { "cluster": "klanten", "description": "Biggie app", "status": "paused" },

    "leenlog":                { "cluster": "tools", "description": "Uitleenregistratie", "status": "active" },
    "uurwerk":                { "cluster": "tools", "description": "Urenregistratie", "status": "active" },
    "urenregistratie":        { "cluster": "tools", "description": "Urenregistratie (ouder)", "status": "paused" },
    "planningregistratie":    { "cluster": "tools", "description": "Planning en registratie", "status": "active" },
    "RendementTool":          { "cluster": "tools", "description": "Rendementsberekening", "status": "paused" },
    "opero":                  { "cluster": "tools", "description": "Operations tool", "status": "paused" },
    "cadence":                { "cluster": "tools", "description": "Ritme- en planningstool", "status": "paused" },
    "bespaarbot":             { "cluster": "tools", "description": "Bespaarbot", "status": "paused" },
    "Walletify":              { "cluster": "tools", "description": "Wallet-passen", "status": "paused" },
    "fix-it-all":             { "cluster": "tools", "description": "Fix-it tool", "status": "paused" }
  },
  "agents": {
    "ux-reviewer":            { "description": "Beoordeelt schermen en flows op bruikbaarheid en toegankelijkheid", "file": "plugins/bold700-core/agents/ux-reviewer.md" },
    "penpot-expert":          { "description": "Penpot API, MCP-server, plugins en design tokens", "file": "plugins/bold700-core/agents/penpot-expert.md" },
    "design-system-guardian": { "description": "Bewaakt tokens, componenten en Material 3", "file": "plugins/bold700-core/agents/design-system-guardian.md" },
    "code-reviewer":          { "description": "Reviewt diffs en PR's op bugs en regressies", "file": "plugins/bold700-core/agents/code-reviewer.md" },
    "fitness-domain":         { "description": "Domeinexpert training, voeding, PT en sporter", "file": "plugins/bold700-core/agents/fitness-domain.md" }
  }
}
